{
  "id": "company-intro-flat-image",
  "purpose": "公司介绍",
  "industry": "通用",
  "style": "扁平简约",
  "expression": "全图大字型",
  "audience": "通用",
  "scenario": "现场汇报",
  "density": "sparse",
  "palette": {
    "roles": {
      "background": { "value": "#ffffff", "usage": "页面背景" },
      "surface": { "value": "#f8fafc", "usage": "卡片/容器底色" },
      "primary": { "value": "#4f46e5", "usage": "主色,品牌标题/大字" },
      "accent": { "value": "#ec4899", "usage": "强调色,亮点/数字" },
      "textStrong": { "value": "#0f172a", "usage": "标题文字" },
      "textBody": { "value": "#475569", "usage": "正文文字" },
      "textMuted": { "value": "#94a3b8", "usage": "来源标注/辅助" },
      "border": { "value": "#e2e8f0", "usage": "描边/分割线" }
    }
  },
  "typography": {
    "roles": {
      "title": {
        "fontFamily": "思源黑体 SC, Source Han Sans SC, Microsoft YaHei, sans-serif",
        "sizeRange": [48, 72],
        "weight": 800,
        "lineHeight": 1.08
      },
      "subtitle": {
        "fontFamily": "思源黑体 SC, Source Han Sans SC, Microsoft YaHei, sans-serif",
        "sizeRange": [24, 32],
        "weight": 600,
        "lineHeight": 1.25
      },
      "body": {
        "fontFamily": "思源黑体 SC, Source Han Sans SC, Microsoft YaHei, sans-serif",
        "sizeRange": [16, 20],
        "weight": 400,
        "lineHeight": 1.55
      },
      "data": {
        "fontFamily": "JetBrains Mono, Consolas, Courier New, monospace",
        "sizeRange": [32, 56],
        "weight": 800,
        "lineHeight": 1.15
      },
      "caption": {
        "fontFamily": "思源黑体 SC, Source Han Sans SC, Microsoft YaHei, sans-serif",
        "sizeRange": [12, 14],
        "weight": 400,
        "lineHeight": 1.4
      }
    }
  },
  "shape": {
    "cornerRadius": { "card": 16, "button": 10, "image": 0, "chip": 999 },
    "shadow": "0 8px 24px rgba(79,70,229,0.12)",
    "borderWidth": 0
  },
  "pageRoleSlots": {
    "cover": { "layout": "cover-hero", "slots": ["eyebrow", "headline", "subhead", "footer"] },
    "agenda": { "layout": "agenda-grid", "slots": ["title", "items"], "density": "sparse" },
    "section": { "layout": "section-divider", "slots": ["index", "title", "lead"] },
    "content": { "layout": "content-split", "slots": ["title", "lead", "body", "visual"], "density": "sparse" },
    "data": { "layout": "data-chart", "slots": ["title", "kpi", "chart", "source"], "density": "sparse" },
    "comparison": { "layout": "comparison-2col", "slots": ["title", "leftCard", "rightCard"] },
    "closing": { "layout": "closing-summary", "slots": ["headline", "takeaways", "contact"] }
  },
  "chart": {
    "palette": ["#4f46e5", "#ec4899", "#0ea5e9", "#10b981", "#f59e0b", "#8b5cf6"],
    "fontFamily": "JetBrains Mono, Consolas, Courier New, monospace",
    "gridColor": "#e2e8f0",
    "axisColor": "#94a3b8"
  },
  "image": {
    "language": "bold-lifestyle",
    "treatment": "full-bleed",
    "cropStyle": "subject-focal"
  }
}
