{
  "id": "thesis-defense-academic-diagram",
  "purpose": "毕业答辩",
  "industry": "教育学术",
  "style": "极简清新",
  "expression": "图解型",
  "audience": "评委",
  "scenario": "现场答辩",
  "density": "balanced",
  "palette": {
    "roles": {
      "background": { "value": "#fbfaf7", "usage": "米白页面背景" },
      "surface": { "value": "#ffffff", "usage": "卡片/容器底色" },
      "primary": { "value": "#1e3a8a", "usage": "学院蓝主色" },
      "accent": { "value": "#0d9488", "usage": "强调色,方法/结论高亮" },
      "textStrong": { "value": "#1f2937", "usage": "标题文字" },
      "textBody": { "value": "#374151", "usage": "正文文字" },
      "textMuted": { "value": "#9ca3af", "usage": "辅助/引用标注" },
      "border": { "value": "#e5e7eb", "usage": "描边/分割线" }
    }
  },
  "typography": {
    "roles": {
      "title": {
        "fontFamily": "思源宋体 SC, Source Han Serif SC, SimSun, serif",
        "sizeRange": [32, 44],
        "weight": 700,
        "lineHeight": 1.2
      },
      "subtitle": {
        "fontFamily": "思源宋体 SC, Source Han Serif SC, SimSun, serif",
        "sizeRange": [20, 26],
        "weight": 600,
        "lineHeight": 1.3
      },
      "body": {
        "fontFamily": "思源宋体 SC, Source Han Serif SC, SimSun, serif",
        "sizeRange": [16, 20],
        "weight": 400,
        "lineHeight": 1.7
      },
      "data": {
        "fontFamily": "JetBrains Mono, Consolas, Courier New, monospace",
        "sizeRange": [20, 32],
        "weight": 600,
        "lineHeight": 1.2
      },
      "caption": {
        "fontFamily": "思源宋体 SC, Source Han Serif SC, SimSun, serif",
        "sizeRange": [12, 14],
        "weight": 400,
        "lineHeight": 1.4
      }
    }
  },
  "shape": {
    "cornerRadius": { "card": 8, "button": 6, "image": 0, "chip": 999 },
    "shadow": "0 2px 6px rgba(31,41,55,0.04)",
    "borderWidth": 1
  },
  "pageRoleSlots": {
    "cover": { "layout": "cover-hero", "slots": ["eyebrow", "headline", "subhead", "footer"] },
    "agenda": { "layout": "agenda-grid", "slots": ["title", "items"] },
    "section": { "layout": "section-divider", "slots": ["index", "title", "lead"] },
    "content": { "layout": "content-split", "slots": ["title", "lead", "body", "visual"] },
    "diagram": { "layout": "diagram-full", "slots": ["title", "lead", "diagram", "caption"], "density": "balanced" },
    "data": { "layout": "data-chart", "slots": ["title", "chart", "source"] },
    "closing": { "layout": "closing-summary", "slots": ["headline", "takeaways", "contact"] }
  },
  "chart": {
    "palette": ["#1e3a8a", "#0d9488", "#b45309", "#7c3aed", "#be123c", "#475569"],
    "fontFamily": "JetBrains Mono, Consolas, Courier New, monospace",
    "gridColor": "#e5e7eb",
    "axisColor": "#9ca3af"
  },
  "image": {
    "language": "minimal-flat",
    "treatment": "no-overlay",
    "cropStyle": "contain"
  }
}
